{
  "route_id": "AI_ONLY_DYAD_KBM_E02_V100",
  "contract_version": "1.0.0",
  "rubric_version": "2.1.0",
  "input_sha256": "d0fb1f4a87f1cf64380f99167d77ecd63fd37b2827c48d044679b6abf027bf42",
  "coder_role": "KBM_COMPANY_E02_V100_AI2",
  "actual_model_label": "Claude Opus 5.5",
  "model_label_source": "Model identity stated in the runtime system prompt of the claude.ai session (currently selected model: Claude Opus 5.5)",
  "run_id": "KBM_E02_V100_AI2_OPUS55_20260930T222005Z",
  "completed_at_utc": "2026-09-30T22:20:05Z",
  "attestation": {
    "other_coder_output_seen": false,
    "prior_episode_outputs_seen": false,
    "outcome_used_as_evidence": false,
    "external_sources_used": false
  },
  "entries": [
    {
      "actor_id": "KBM_MANAGEMENT_FORMAL_RESPONSE_20110527",
      "factor": "POS_AO2",
      "status": "NUMERIC",
      "value": 5,
      "admission_checks": {"C1": true, "C2": true, "C3": true, "C4": true, "C5": true, "C6": true, "C7": true, "C8": true},
      "evidence_references": ["KBM_NOMAD_PRESS_RESPONSE_20110527"],
      "rationale": "Сообщение пресс-службы КБМ (атрибуция на архивной странице Nomad явная) отклоняет требуемые забастовщиками повышающие коэффициенты оплаты как необоснованные и ссылается на официальные/правовые заключения в поддержку действующего порядка. Это явная защита как минимум одного существенного компонента статус-кво (действующий порядок/структура оплаты) против требуемого изменения — якорь +5 выполнен полностью. Якорь +10 не выполнен: в замороженном доказательстве нет явной защиты всей референции по всем существенным компонентам, в частности социальных гарантий, и нет общего отказа от любого существенного изменения. Сообщения о собственных регулярных повышениях зарплат (59,5–90,1% за 2007–2011) и предложение решать спор за столом переговоров не являются требованием изменить порядок оплаты и не переводят позицию к 0 или -5; они представлены как обоснование достаточности действующей практики. Расхождение дат (отчёт 27.05.2011, dateline страницы 26.05.2011) учтено и не влияет на идентичность актора в рамках зафиксированной non-simultaneous диады; carry-forward не применялся.",
      "confidence": {
        "kind": "QUALITATIVE_UNCALIBRATED",
        "value": "MEDIUM",
        "meaning": "CONFIDENCE_IN_RECORDED_CODING_DECISION",
        "rationale": "Защита компонента оплаты явная и атрибутирована КБМ, что надёжно исключает значения ≤0. Граница +5/+10 зависит от того, покрывает ли ответ всю референцию; доступное доказательство касается только оплаты/коэффициентов и не затрагивает социальные гарантии, поэтому выбран +5, но свидетельство передано в пересказе с ограниченными цитатами."
      },
      "calculation_release": false
    },
    {
      "actor_id": "KBM_MANAGEMENT_FORMAL_RESPONSE_20110527",
      "factor": "KVS_AO2",
      "status": "NUMERIC",
      "value": 5,
      "admission_checks": {"C1": true, "C2": true, "C3": true, "C4": true, "C5": true, "C6": true, "C7": true, "C8": true},
      "evidence_references": ["KBM_NOMAD_PRESS_RESPONSE_20110527"],
      "rationale": "Правило реактивного актора соблюдено: вывод основан не на самом отклонении требований как необоснованных, а на дополнительной явной связи вопроса оплаты с собственным заявленным набором действий и решений КБМ — регулярные повышения заработной платы, заявленный накопленный диапазон повышения 2007–2011 гг. («от 59,5% до 90,1 %») и текущие минимальные/максимальные тарифные ставки. Тем самым вопрос оплаты явно включён в собственный декларированный набор действий/тарифной политики актора — якорь 5 выполнен полностью. Якорь 8 не выполнен: предложение урегулировать спор «за столом переговоров» относится к трудовому спору в целом и не содержит явного условия, при котором участие, отказ или урегулирование поставлено в зависимость именно от решения вопроса оплаты. Якорь 10 не выполнен: нет явного заявления о неотъемлемости позиции и отказа от варианта урегулирования без неё. Якоря 0 и 2 исключены: вопрос не объявлен нерелевантным или второстепенным. Интенсивность, длительность забастовки, численность, потери добычи и санкции не использовались.",
      "confidence": {
        "kind": "QUALITATIVE_UNCALIBRATED",
        "value": "MEDIUM",
        "meaning": "CONFIDENCE_IN_RECORDED_CODING_DECISION",
        "rationale": "Связь с собственными действиями КБМ по оплате явная, что поддерживает 5 над простым реактивным упоминанием; отсутствие pay-specific условности надёжно исключает 8. Неопределённость остаётся в том, насколько описанные прошлые повышения читаются как текущий декларированный набор действий, а не только как аргумент опровержения."
      },
      "calculation_release": false
    }
  ]
}
